title,link
Calculating The Probability An Economy Class Seat Is An Aisle,http://chrisalbon.com/projects/aisle_seat_probabilities.html
Geocoding And Reverse Geocoding,http://chrisalbon.com/python/geocoding_and_reverse_geocoding.html
Apply Operations Over Items In A List,http://chrisalbon.com/python/apply_operations_over_items_in_lists.html
Applying Conditional Functions To List Items,http://chrisalbon.com/python/applying_conditional_functions_to_list_items.html
Applying Functions To List Items,http://chrisalbon.com/python/applying_functions_to_list_items.html
Basic Arithmetic,http://chrisalbon.com/python/arithmetic_basics.html
Assignment Operators,http://chrisalbon.com/python/assignment_operators.html
Drilling Down With Beautiful Soup,http://chrisalbon.com/python/beautiful_soup_drill_down.html
Beautiful Soup Basic HTML Scraping,http://chrisalbon.com/python/beautiful_soup_html_basics.html
Scraping a HTML Table with Beauitful Soup,http://chrisalbon.com/python/beautiful_soup_scrape_table.html
Scraping And Parsing A Wikipedia List into Pandas,http://chrisalbon.com/python/beautiful_soup_scraping_into_pandas.html
Breaking Up String Variables,http://chrisalbon.com/python/breaking_up_string_variables.html
Brute Force D20 Roll Simulator,http://chrisalbon.com/python/brute_force_d20_simulator.html
Built-In Object Types,http://chrisalbon.com/python/built_in_object_types.html
Cartesian Product,http://chrisalbon.com/python/cartesian_product.html
Cleaning Text,http://chrisalbon.com/python/cleaning_text.html
Continue And Break Loops,http://chrisalbon.com/python/continue_and_break_loops.html
Convert A String Categorical Variable To A Numeric Variable Naively,http://chrisalbon.com/python/convert_categorical_to_numeric_naively.html
Creating Lists From Dictionary Keys And Values,http://chrisalbon.com/python/create_list_from_dictionary_keys_and_values.html
Creating Numpy Arrays,http://chrisalbon.com/python/creating_numpy_arrays.html
Convert A CSV Into Python Code To Recreate It,http://chrisalbon.com/python/csv_to_python_code.html
Data Structure Basics,http://chrisalbon.com/python/data_structure_basics.html
Prussian Horse Kick Data,http://chrisalbon.com/python/dataset_prussian_horse_kicks.html
Battle of Five Kings Dataset,http://chrisalbon.com/python/dataset_war_of_five_kings.html
Date And Time Basics,http://chrisalbon.com/python/date_and_time_basics.html
Dictionary Basics,http://chrisalbon.com/python/dictionary_basics.html
Enumerate A List,http://chrisalbon.com/python/enumerate_a_list.html
Escape Sequences,http://chrisalbon.com/python/escape_sequences.html
Creating A List Of Potential Baby Names,http://chrisalbon.com/python/example_data_wrangling_baby_names.html
Wrangling DHS Border Crossing Data,http://chrisalbon.com/python/example_exploring_border_crossing_data.html
Selecting Items In A List With Filters,http://chrisalbon.com/python/filter_items_in_list_with_filter.html
Flatten Lists Of Lists,http://chrisalbon.com/python/flatten_list_of_lists.html
For Loop,http://chrisalbon.com/python/for_loops.html
The Format Method,http://chrisalbon.com/python/format_method_for_strings.html
Function Basics,http://chrisalbon.com/python/function_basics.html
Generating Random Numbers With Numpy,http://chrisalbon.com/python/generating_random_numbers_with_numpy.html
Draw a area plot in ggplot,http://chrisalbon.com/python/ggplot_area_plot.html
Draw a line in ggplot,http://chrisalbon.com/python/ggplot_draw_line.html
Draw a histogram plot in ggplot,http://chrisalbon.com/python/ggplot_histogram.html
Draw a line plot in ggplot,http://chrisalbon.com/python/ggplot_line_plot.html
Saving ggplot plots as vector,http://chrisalbon.com/python/ggplot_save_as_vector.html
Scatterplots in ggplot,http://chrisalbon.com/python/ggplot_scatterplot.html
if and if else,http://chrisalbon.com/python/if_and_if_else_statements.html
if Statement,http://chrisalbon.com/python/if_statement.html
Indexing And Slicing Numpy Arrays,http://chrisalbon.com/python/indexing_and_slicing_numpy_arrays.html
View an image in iPython,http://chrisalbon.com/python/ipython_display_image.html
View an video in iPython,http://chrisalbon.com/python/ipython_display_video.html
Run A Python Script Inside IPython,http://chrisalbon.com/python/ipython_run_script.html
Iterate An Ifelse Over A List,http://chrisalbon.com/python/iterate_ifelse_over_list.html
Parse JSON File,http://chrisalbon.com/python/json_parse_file.html
Kolmogorov Smirnov Test,http://chrisalbon.com/python/kolmogorov_smirnov_test.html
Lambda Functions,http://chrisalbon.com/python/lambda_functions.html
List Comprehension 1,http://chrisalbon.com/python/list_comprehension.html
List Comprehension 2,http://chrisalbon.com/python/list_comprehension_2.html
List Operations,http://chrisalbon.com/python/list_operations.html
Logical Operations,http://chrisalbon.com/python/logical_operations.html
Mathematical Operations,http://chrisalbon.com/python/math_operations.html
Back To Back Bar Plot In MatPlotLib,http://chrisalbon.com/python/matplotlib_back_to_back_bar_plot.html
Bar Plot In MatPlotLib,http://chrisalbon.com/python/matplotlib_bar_plot.html
Group Bar Plot In MatPlotLib,http://chrisalbon.com/python/matplotlib_grouped_bar_plot.html
Histograms In MatPlotLib,http://chrisalbon.com/python/matplotlib_histogram.html
Map Your Google Location History,http://chrisalbon.com/python/matplotlib_map_your_google_data.html
Stacked Percentage Bar Plot In MatPlotLib,http://chrisalbon.com/python/matplotlib_percentage_stacked_bar_plot.html
Pie Chart In MatPlotLib,http://chrisalbon.com/python/matplotlib_pie_chart.html
Plot Points On A Map,http://chrisalbon.com/python/matplotlib_plot_points_on_map.html
Save A Matplotlib Plot As A Vector,http://chrisalbon.com/python/matplotlib_save_a_plot_as_vector.html
Making A Matplotlib Scatterplot From A Pandas Dataframe,http://chrisalbon.com/python/matplotlib_scatterplot_from_pandas.html
"Matplotlib, A Simple Example",http://chrisalbon.com/python/matplotlib_simple_example.html
Scatterplot In MatPlotLib,http://chrisalbon.com/python/matplotlib_simple_scatterplot.html
Stacked Bar Plot In MatPlotLib,http://chrisalbon.com/python/matplotlib_stacked_bar_plot.html
Module Basics,http://chrisalbon.com/python/module_basics.html
Nesting Lists,http://chrisalbon.com/python/nesting_lists.html
Basic Opeations With Numpy Array,http://chrisalbon.com/python/numpy_array_basic_operations.html
Numpy Array Basics,http://chrisalbon.com/python/numpy_array_basics.html
Indexing And Slicing Numpy Arrays,http://chrisalbon.com/python/numpy_indexing_and_slicing.html
Applying Operations Over pandas Dataframes,http://chrisalbon.com/python/pandas_apply_operations_to_dataframes.html
Apply Operations To Groups In Pandas,http://chrisalbon.com/python/pandas_apply_operations_to_groups.html
Binning Data In Pandas,http://chrisalbon.com/python/pandas_binning_data.html
Categorical Data In Pandas,http://chrisalbon.com/python/pandas_categorical_data.html
Convert A Categorical Variable Into Dummy Variables,http://chrisalbon.com/python/pandas_convert_categorical_to_dummies.html
Convert A Numeric Categorical Variable With Patsy,http://chrisalbon.com/python/pandas_convert_numeric_categorical_to_numeric_with_patsy.html
Convert A String Categorical Variable With Patsy,http://chrisalbon.com/python/pandas_convert_string_categorical_to_numeric_with_patsy.html
Convert A Variable To A Time Variable In Pandas,http://chrisalbon.com/python/pandas_convert_to_datetime.html
Create a Column Based on a Conditional in pandas,http://chrisalbon.com/python/pandas_create_column_using_conditional.html
Create A Pandas Column With A For Loop,http://chrisalbon.com/python/pandas_create_column_with_loop.html
Crosstabs In Pandas,http://chrisalbon.com/python/pandas_crosstabs.html
pandas Data Structures,http://chrisalbon.com/python/pandas_data_structures.html
Data Wrangling In Pandas,http://chrisalbon.com/python/pandas_data_wrangling.html
Count Values In Pandas Dataframe,http://chrisalbon.com/python/pandas_dataframe_count_values.html
Descriptive Statistics For pandas Dataframe,http://chrisalbon.com/python/pandas_dataframe_descriptive_stats.html
Loading A CSV Into Pandas,http://chrisalbon.com/python/pandas_dataframe_importing_csv.html
Load Excel Spreadsheet As Pandas Dataframe,http://chrisalbon.com/python/pandas_dataframe_load_xls.html
Ranking Rows Of pandas Dataframes,http://chrisalbon.com/python/pandas_dataframe_ranking_rows.html
Reindexing pandas Series And Dataframes,http://chrisalbon.com/python/pandas_dataframe_reindexing.html
Delete Duplicates In Pandas,http://chrisalbon.com/python/pandas_delete_duplicates.html
Drop A Column That Contains A Certain String In Pandas,http://chrisalbon.com/python/pandas_drop_column_containing_certain_string.html
Dropping Rows And Columns In pandas Dataframe,http://chrisalbon.com/python/pandas_dropping_column_and_rows.html
Simple Example Dataframe,http://chrisalbon.com/python/pandas_example_dataframes.html
Expand Cells Containing Lists Into Their Own Variables In Pandas,http://chrisalbon.com/python/pandas_expand_cells_containing_lists.html
Find Largest Value In A Dataframe Column,http://chrisalbon.com/python/pandas_find_largest_value_in_column.html
Find Unique Values In Pandas Dataframes,http://chrisalbon.com/python/pandas_find_unique_values.html
Grouping Rows In Pandas,http://chrisalbon.com/python/pandas_group_rows_by.html
Hierarchical Data In Pandas,http://chrisalbon.com/python/pandas_hierarchical_data.html
Importing an HTML table into pandas,http://chrisalbon.com/python/pandas_import_html_table.html
"Index, Select, And Filter pandas Dataframes",http://chrisalbon.com/python/pandas_index_select_and_filter.html
Indexing and Selecting Data With Pandas,http://chrisalbon.com/python/pandas_indexing_selecting.html
Iterating Through The Rows Of Multiple Columns In Pandas,http://chrisalbon.com/python/pandas_iterate_over_rows_of_multiple_columns.html
Join And Merge Pandas Dataframe,http://chrisalbon.com/python/pandas_join_merge_dataframe.html
Using List Comprehensions With Pandas,http://chrisalbon.com/python/pandas_list_comprehension.html
List Unique Values In A Pandas Column,http://chrisalbon.com/python/pandas_list_unique_values_in_column.html
Pandas: Long To Wide Format,http://chrisalbon.com/python/pandas_long_to_wide.html
Lower Case Column Names In Pandas Dataframe,http://chrisalbon.com/python/pandas_lowercase_column_names.html
Make New Columns Using Functions,http://chrisalbon.com/python/pandas_make_new_columns_using_functions.html
Map External Values To Dataframe Values in Pandas,http://chrisalbon.com/python/pandas_map_values_to_values.html
Missing Data In Pandas Dataframe,http://chrisalbon.com/python/pandas_missing_data.html
Moving Averages In Pandas,http://chrisalbon.com/python/pandas_moving_average.html
Normalize A Column In Pandas,http://chrisalbon.com/python/pandas_normalize_column.html
Dealing With Outliers In Pandas,http://chrisalbon.com/python/pandas_outliers.html
Pivot Tables In Pandas,http://chrisalbon.com/python/pandas_pivot_tables.html
Breaking Up A String Into Columns Using Regex In Pandas,http://chrisalbon.com/python/pandas_regex_to_create_columns.html
Rename Multiple Pandas Dataframe Column Names At Once,http://chrisalbon.com/python/pandas_rename_multiple_columns.html
Replacing Values In Pandas,http://chrisalbon.com/python/pandas_replace_values.html
Resampling a Time Series in pandas,http://chrisalbon.com/python/pandas_resample_by_time.html
Sample Rows Of A Dataframe In Pandas,http://chrisalbon.com/python/pandas_sample_dataframe.html
Random Sampling Dataframe,http://chrisalbon.com/python/pandas_sampling_dataframe.html
Saving A Pandas Dataframe As a CSV,http://chrisalbon.com/python/pandas_saving_dataframe_as_csv.html
Search A Pandas Column For A Value,http://chrisalbon.com/python/pandas_search_column_for_value.html
Select Rows That Have A Certain Value,http://chrisalbon.com/python/pandas_select_rows_containing_values.html
Select Rows With Multiple Filters,http://chrisalbon.com/python/pandas_select_rows_multiple_filters.html
Select Rows When Columns Contain Certain Values,http://chrisalbon.com/python/pandas_select_rows_when_column_has_certain_values.html
Selecting Pandas DataFrame Rows Based On Conditions,http://chrisalbon.com/python/pandas_selecting_rows_on_conditions.html
Sorting Rows Of pandas Dataframes,http://chrisalbon.com/python/pandas_sorting_rows_dataframe.html
Split Combined Lat/Long Coordinate Variables Into Seperate Variables In Pandas,http://chrisalbon.com/python/pandas_split_lat_and_long_into_variables.html
String Munging In Dataframe,http://chrisalbon.com/python/pandas_string_munging.html
Pandas Time Series Basics,http://chrisalbon.com/python/pandas_time_series_basics.html
Transpose A Dataframe In Pandas,http://chrisalbon.com/python/pandas_transpose_dataframe.html
"Try, Except, and Finally",http://chrisalbon.com/python/try_except_finally.html
Using Seaborn To Visualize A Pandas Dataframe,http://chrisalbon.com/python/pandas_with_seaborn.html
Polynomial Fitting,http://chrisalbon.com/python/polynomial_fitting.html
Recursive Functions,http://chrisalbon.com/python/recursive_functions.html
Regular Expression By Example,http://chrisalbon.com/python/regex_by_example.html
Regular Expression Basics,http://chrisalbon.com/python/regular_expressions_basics.html
Scheduling Jobs In The Future,http://chrisalbon.com/python/schedule_run_in_the_future.html
Finding A Trend Line Of Data,http://chrisalbon.com/python/scipy_fitting_trendline.html
Simple Clustering With SciPy,http://chrisalbon.com/python/scipy_simple_clustering.html
Color Palettes in Seaborn,http://chrisalbon.com/python/seaborn_color_palettes.html
Creating A Time Series Plot With Seaborne And Pandas,http://chrisalbon.com/python/seaborn_pandas_timeseries_plot.html
Make Pretty Time Series Plots With Seaborne,http://chrisalbon.com/python/seaborn_pretty_timeseries_plots.html
Creating Scatterplots with Seaborn,http://chrisalbon.com/python/seaborn_scatterplot.html
Set The Color Of A Matplotlib Plot,http://chrisalbon.com/python/set_the_color_of_a_matplotlib.html
Built-In Object Types,http://chrisalbon.com/python/standard_object_types.html
String Formatting,http://chrisalbon.com/python/string_formatting.html
String Indexing,http://chrisalbon.com/python/string_indexing.html
String Operations,http://chrisalbon.com/python/string_operations.html
Converting Strings To Datetime,http://chrisalbon.com/python/strings_to_datetime.html
Swapping variable values,http://chrisalbon.com/python/swapping_variable_values.html
Test Script,http://chrisalbon.com/python/testing_the_stack.html
while Statement,http://chrisalbon.com/python/while_statements.html
Two Way Frequency Table,http://chrisalbon.com/rstats/2-way-frequency-table.html
2D Density Plot,http://chrisalbon.com/rstats/2d-density-plot.html
Adding Time To A Date,http://chrisalbon.com/rstats/add-dates-to-a-date.html
Adding labels to a ggplot2 bar graph,http://chrisalbon.com/rstats/add-labels-to-bar-graph.html
Adding Levels To A Factor,http://chrisalbon.com/rstats/add-levels-to-factors.html
Annotating Plots,http://chrisalbon.com/rstats/annotating-plots.html
Apply A Function On Every Row Of A Dataframe,http://chrisalbon.com/rstats/apply-function-to-every-row.html
"Using apply, sapply, and lapply",http://chrisalbon.com/rstats/apply-lapply-sapply.html
Advanced Applying With Plyr,http://chrisalbon.com/rstats/apply-with-plyr.html
Basic Math Functions In R,http://chrisalbon.com/rstats/arithmetic.html
Making A Back To Back Histogram,http://chrisalbon.com/rstats/back-to-back-histogram.html
Balloon Plot,http://chrisalbon.com/rstats/balloon-plot.html
Bar Charts,http://chrisalbon.com/rstats/bar-charts.html
Bar Graph,http://chrisalbon.com/rstats/bar-graph.html
Bar Graph Of Two Sets Of Data,http://chrisalbon.com/rstats/barplot-two-sets-of-data.html
Benchmarking R Speed,http://chrisalbon.com/rstats/benchmarking.html
Boxplots,http://chrisalbon.com/rstats/boxplots.html
Calculate A Moving Average,http://chrisalbon.com/rstats/calculate-moving-average.html
Converting Categorical Variables To Continuous,http://chrisalbon.com/rstats/categorical-to-continous.html
Change The Barplot Bar Width,http://chrisalbon.com/rstats/change-barplot-bar-width.html
Change The Class Of An Object,http://chrisalbon.com/rstats/change-object-class.html
Character Dates,http://chrisalbon.com/rstats/character-dates.html
Check To See If A Variable Exists,http://chrisalbon.com/rstats/check-if-variable-exists.html
Circle Plot,http://chrisalbon.com/rstats/circle-plot.html
Classes,http://chrisalbon.com/rstats/classes.html
Cleaning Up Gender,http://chrisalbon.com/rstats/cleaning-gender.html
Cleaning Strings,http://chrisalbon.com/rstats/cleaning-strings.html
Cleveland Plot,http://chrisalbon.com/rstats/cleveland-plot.html
Coloring Boxplot Outliers,http://chrisalbon.com/rstats/color-boxplot-outliers.html
Combining Factors,http://chrisalbon.com/rstats/combining-factors.html
Comma Seperate A String,http://chrisalbon.com/rstats/comma-seperate-a-string.html
Conditional execution,http://chrisalbon.com/rstats/conditional.html
Converting Continous Variables To Categorical Variables,http://chrisalbon.com/rstats/continous-to-categorical.html
Converting Between Wide And Long Form Data,http://chrisalbon.com/rstats/convert-between-wide-and-long.html
Converting List Of Dataframes Into A Single Dataframe,http://chrisalbon.com/rstats/convert-list-of-dfs-into-one-df.html
Convert Strings To Objects,http://chrisalbon.com/rstats/convert-strings-to-objects.html
Count The Number Of Times X Appears In A Vector,http://chrisalbon.com/rstats/count-number-elements.html
Crosstabs,http://chrisalbon.com/rstats/crosstabs.html
Cutting Up Data,http://chrisalbon.com/rstats/cutting-up-data.html
Data Types,http://chrisalbon.com/rstats/data-types.html
Data Frames,http://chrisalbon.com/rstats/dataframes.html
Datasets,http://chrisalbon.com/rstats/datasets.html
Difference Between Two Date-Times,http://chrisalbon.com/rstats/date-sequences.html
Density Curve Plot,http://chrisalbon.com/rstats/density-plot.html
Difference Between Two Date-Times,http://chrisalbon.com/rstats/difference-between-two-dates.html
Dot Plot (Wilkinson Plot),http://chrisalbon.com/rstats/dot-plot.html
Drop Columns From Dataframe,http://chrisalbon.com/rstats/drop-columns-from-dataframe.html
Drop Residual Factors,http://chrisalbon.com/rstats/drop-residual-factors.html
Element Names,http://chrisalbon.com/rstats/element-names.html
Expand A Table Of Counts Into A Dataframe,http://chrisalbon.com/rstats/expand-counts-into-dataframe.html
Exponents,http://chrisalbon.com/rstats/exponents.html
Faceting in ggplot2,http://chrisalbon.com/rstats/faceting.html
Factors,http://chrisalbon.com/rstats/factors.html
File Paths,http://chrisalbon.com/rstats/file-paths.html
Classes,http://chrisalbon.com/rstats/find-a-variables-class.html
Find And Replace,http://chrisalbon.com/rstats/find-and-replace.html
Finding the location (the index) of the first instance of values in a vector,http://chrisalbon.com/rstats/find-index-of-first-values.html
Finding the most common element,http://chrisalbon.com/rstats/find-most-common-element.html
apropos functions finds objects and functions,http://chrisalbon.com/rstats/find-objects-variables-functions.html
Find Unique Elements In Objects,http://chrisalbon.com/rstats/find-unique-elements.html
Flow Control,http://chrisalbon.com/rstats/flow-control.html
For Loops,http://chrisalbon.com/rstats/for-loop.html
Frequency Polygon Plot,http://chrisalbon.com/rstats/frequency-polygon-plot.html
Gantt Charts,http://chrisalbon.com/rstats/gantt-chart.html
Basic ggplot2 examples,http://chrisalbon.com/rstats/ggplot2-basic-examples.html
Heatmap For Factors,http://chrisalbon.com/rstats/heatmap-for-factors.html
Create High-Res Plots In R,http://chrisalbon.com/rstats/high-res-plots.html
Hills And Valley Bar Chart,http://chrisalbon.com/rstats/hills-and-valleys-chart.html
Histogram,http://chrisalbon.com/rstats/histogram.html
Histograms and Density Plots,http://chrisalbon.com/rstats/histograms-and-density-plots.html
Using ifelse,http://chrisalbon.com/rstats/ifelse.html
Importing Baltimore's 2010 Monthly Crime Data,http://chrisalbon.com/rstats/import-data.html
Importing a JSON file into R,http://chrisalbon.com/rstats/import-json.html
Import XML,http://chrisalbon.com/rstats/import-xml.html
Importing CSV and Delimited Data,http://chrisalbon.com/rstats/importing-csv-and-delimited-data.html
Indexing Tricks,http://chrisalbon.com/rstats/indexing-tricks.html
Indexing,http://chrisalbon.com/rstats/indexing.html
"Inner, Outer, Right, And Left Joins",http://chrisalbon.com/rstats/inner-outter-right-left-join.html
Installing and loading packages,http://chrisalbon.com/rstats/installing-and-loading-packages.html
Jitterplot,http://chrisalbon.com/rstats/jitterplot.html
Line and Path Plots,http://chrisalbon.com/rstats/line-and-path-plots.html
Line Graph,http://chrisalbon.com/rstats/line-graph.html
Line Plot With Multiple Lines,http://chrisalbon.com/rstats/line-plot-with-multiple-lines.html
Plot With Both Lines And Poiints,http://chrisalbon.com/rstats/line-plot-with-points.html
ggplot2 line plot,http://chrisalbon.com/rstats/line-plot.html
Indexing Lists,http://chrisalbon.com/rstats/list-indexing.html
Convert A List Into A Dataframe,http://chrisalbon.com/rstats/list-to-dataframe.html
Lists,http://chrisalbon.com/rstats/lists.html
Loops With Lists,http://chrisalbon.com/rstats/loops-with-lists.html
Loops,http://chrisalbon.com/rstats/loops.html
Managing Data Frames,http://chrisalbon.com/rstats/managing-data-frames.html
Manipulating Character Strings (i.e. text),http://chrisalbon.com/rstats/manipulate-character-strings.html
Find Which Column Has The Greatest Value In Each Row,http://chrisalbon.com/rstats/max-columns-value.html
Merge Data Frames,http://chrisalbon.com/rstats/merge-data-frame.html
Missing values,http://chrisalbon.com/rstats/missing-data.html
Removing Missing Observations,http://chrisalbon.com/rstats/missing-obs.html
Extracting Information From Objects Using Names(),http://chrisalbon.com/rstats/names.html
Normality Test,http://chrisalbon.com/rstats/normality-test.html
Find Approximate Number Of Google Search Results For A String,http://chrisalbon.com/rstats/number-of-google-search-results.html
Object Basics,http://chrisalbon.com/rstats/objects-101.html
Ordered Factors,http://chrisalbon.com/rstats/ordered-factors.html
Overlapping Histrograms,http://chrisalbon.com/rstats/overlapping-histograms.html
Parsing Dates,http://chrisalbon.com/rstats/parsing-dates.html
Password Generator,http://chrisalbon.com/rstats/password-generator.html
Pie Chart,http://chrisalbon.com/rstats/pie-chart.html
Plot Points On A Map,http://chrisalbon.com/rstats/plots-on-map.html
Making Pretty Numbers with prettyNum,http://chrisalbon.com/rstats/pretty-numbers.html
Proporton Table,http://chrisalbon.com/rstats/proportion-table.html
Proportional Stacked Bar Graph,http://chrisalbon.com/rstats/proportional-stacked-bar-graph.html
Getting Familiar With R,http://chrisalbon.com/rstats/r-basics.html
Racetrack Plot,http://chrisalbon.com/rstats/racetrack-plot.html
Radial Plot,http://chrisalbon.com/rstats/radial-plot.html
Random Numbers,http://chrisalbon.com/rstats/random-numbers.html
Removing Variables,http://chrisalbon.com/rstats/remote-variable.html
Remove Duplicate Rows,http://chrisalbon.com/rstats/remove-duplicate-rows.html
Removing Observations In Data Frames With Missing Data,http://chrisalbon.com/rstats/removing-missing-obs.html
Renaming Filenames,http://chrisalbon.com/rstats/rename-filesnames.html
Reorder Columns,http://chrisalbon.com/rstats/reorder-columns.html
Replacing Data,http://chrisalbon.com/rstats/replacing-data.html
Replacing Factor Names Using Match,http://chrisalbon.com/rstats/replacing-factor-names.html
Loops With Replicate,http://chrisalbon.com/rstats/replication-loops.html
Rounding Numbers,http://chrisalbon.com/rstats/rounding.html
Rug Plot,http://chrisalbon.com/rstats/rugplot.html
Getting A Sample Of Random Rows From A Dataframe,http://chrisalbon.com/rstats/sampling-a-dataframe.html
Sampling in R,http://chrisalbon.com/rstats/sampling.html
Smooth A Scatterplot Trend Line,http://chrisalbon.com/rstats/scatterplot-trend-line.html
Scatter plot two sets of data with smooth lines,http://chrisalbon.com/rstats/scatterplot-two-sets-of-data.html
Plot Ellipses With Scatterplot,http://chrisalbon.com/rstats/scatterplot-with-ellipses-by-group.html
Scatterplot With Point's Labelled,http://chrisalbon.com/rstats/scatterplot-with-point-labels.html
Scatterplot With Trend Line,http://chrisalbon.com/rstats/scatterplot-with-trendline.html
Scatter Plot (Basic),http://chrisalbon.com/rstats/scatterplot.html
Scatterplots using ggplot2,http://chrisalbon.com/rstats/scatterplots-ggplot2.html
Scraping Web Pages,http://chrisalbon.com/rstats/scraping-webpages.html
Selecting Data According To Patterns,http://chrisalbon.com/rstats/select-data-according-to-patterns.html
Select Rows By Logical Test,http://chrisalbon.com/rstats/select-rows-by-logical-test.html
Create a sequences of numbers,http://chrisalbon.com/rstats/sequences.html
Simple Venn Diagram,http://chrisalbon.com/rstats/simple-venn-diagram.html
Simulated Data From Normal Distribution Function,http://chrisalbon.com/rstats/simulated-data-from-norm-distributions.html
Size Plot,http://chrisalbon.com/rstats/sizeplot.html
Sorting A Data Frame By A Single Column,http://chrisalbon.com/rstats/sort-dataframe-by-columns.html
Sorting Columns Of A Data Frame,http://chrisalbon.com/rstats/sort-dataframe-columns.html
Sorting Data Frames,http://chrisalbon.com/rstats/sorting-dataframes.html
Special Characters In Strings,http://chrisalbon.com/rstats/special-characters-in-strings.html
"Split, Apply, Combine",http://chrisalbon.com/rstats/split-apply-combine.html
"Split, Apply, Recombine",http://chrisalbon.com/rstats/split-apply-recombine.html
Data can be split up by levels of a factor,http://chrisalbon.com/rstats/split-data-by-factor-levels.html
Simple Random Sampling Of Rows,http://chrisalbon.com/rstats/srs-of-rows.html
